{
  "schema_version": 1,
  "dataset_id": "multimodal-retrieval-v1-synthetic",
  "dataset_version": "v1",
  "dataset_kind": "synthetic",
  "dataset_status": "synthetic_fixture",
  "render_policy": "rasterize-before-evaluation",
  "source_assets": [
    {
      "asset_id": "mm-asset-diagram-flow",
      "path": "tests/fixtures/multimodal/diagram_flow.svg",
      "sha256": "036259bd9647564055898e80b61b4f80b43a5e9c8360c6c1212d8ba6307f1394",
      "mime_type": "image/svg+xml",
      "permission": "synthetic-approved",
      "surrounding_text": "Request path diagram.",
      "regions": [
        {"region_id": "region-flow-title", "bbox": [0.04, 0.04, 0.35, 0.12], "kind": "title"},
        {"region_id": "region-flow-sequence", "bbox": [0.07, 0.34, 0.86, 0.28], "kind": "diagram"}
      ]
    },
    {
      "asset_id": "mm-asset-latency-chart",
      "path": "tests/fixtures/multimodal/latency_chart.svg",
      "sha256": "0b4135cb9e465ca50fba501b3b391cbc00d9c5dcf25e00a015f63003bdd53eb0",
      "mime_type": "image/svg+xml",
      "permission": "synthetic-approved",
      "surrounding_text": "Warm query latency by method.",
      "regions": [
        {"region_id": "region-latency-title", "bbox": [0.04, 0.03, 0.48, 0.13], "kind": "title"},
        {"region_id": "region-latency-bars", "bbox": [0.13, 0.18, 0.81, 0.70], "kind": "chart"}
      ]
    },
    {
      "asset_id": "mm-asset-assessment-table",
      "path": "tests/fixtures/multimodal/assessment_table.svg",
      "sha256": "23819562449476c6a778ee6b84371b1a5c24e857c24232ba318b9d32341720a0",
      "mime_type": "image/svg+xml",
      "permission": "synthetic-approved",
      "surrounding_text": "Assessment weights.",
      "regions": [
        {"region_id": "region-assessment-title", "bbox": [0.04, 0.03, 0.42, 0.13], "kind": "title"},
        {"region_id": "region-assessment-grid", "bbox": [0.10, 0.20, 0.80, 0.64], "kind": "table"}
      ]
    },
    {
      "asset_id": "mm-asset-softmax-equation",
      "path": "tests/fixtures/multimodal/softmax_equation.svg",
      "sha256": "718d8febbf7f4952fa961f80818927fd345d9e09bd445ec7f008f6b09715e76d",
      "mime_type": "image/svg+xml",
      "permission": "synthetic-approved",
      "surrounding_text": "Softmax normalization.",
      "regions": [
        {"region_id": "region-softmax-title", "bbox": [0.04, 0.03, 0.48, 0.13], "kind": "title"},
        {"region_id": "region-softmax-expression", "bbox": [0.28, 0.28, 0.44, 0.38], "kind": "equation"}
      ]
    },
    {
      "asset_id": "mm-asset-settings-screen",
      "path": "tests/fixtures/multimodal/settings_screenshot.svg",
      "sha256": "19a552d2c22df7c07de6294aed41d2383c529340cbb8b4adf8eff4e832c09a7d",
      "mime_type": "image/svg+xml",
      "permission": "synthetic-approved",
      "surrounding_text": "Course access settings screen.",
      "regions": [
        {"region_id": "region-settings-panel", "bbox": [0.08, 0.10, 0.84, 0.80], "kind": "interface"}
      ]
    },
    {
      "asset_id": "mm-asset-scanned-notice",
      "path": "tests/fixtures/multimodal/scanned_notice.svg",
      "sha256": "07542f19988d356f8b915b9a436503e8995865fe13a36855431b052a89cf2112",
      "mime_type": "image/svg+xml",
      "permission": "synthetic-approved",
      "surrounding_text": "Scanned lab notice.",
      "regions": [
        {"region_id": "region-notice-body", "bbox": [0.15, 0.10, 0.70, 0.80], "kind": "scanned_text"}
      ]
    },
    {
      "asset_id": "mm-asset-architecture-layers",
      "path": "tests/fixtures/multimodal/architecture_layers.svg",
      "sha256": "536b57b2dcfe7f5a0d8da600cf86c9c1b25f6867b5f3480375d41e2d8598d67e",
      "mime_type": "image/svg+xml",
      "permission": "synthetic-approved",
      "surrounding_text": "Course assistant architecture.",
      "regions": [
        {"region_id": "region-architecture-flow", "bbox": [0.08, 0.20, 0.84, 0.64], "kind": "diagram"}
      ]
    },
    {
      "asset_id": "mm-asset-complexity-table",
      "path": "tests/fixtures/multimodal/complexity_table.svg",
      "sha256": "bfb9e6388ac593a4445d1b7794896a6e25b7898a239b5e7b77deab89d0230773",
      "mime_type": "image/svg+xml",
      "permission": "synthetic-approved",
      "surrounding_text": "Operation complexity table.",
      "regions": [
        {"region_id": "region-complexity-grid", "bbox": [0.11, 0.20, 0.78, 0.60], "kind": "table"}
      ]
    },
    {
      "asset_id": "mm-asset-recurrence-equation",
      "path": "tests/fixtures/multimodal/recurrence_equation.svg",
      "sha256": "13774a03b3cc90f813c7c95af4458bf4816604bf2d0ab8bb94b40fd5f4ea3f03",
      "mime_type": "image/svg+xml",
      "permission": "synthetic-approved",
      "surrounding_text": "Divide-and-conquer recurrence.",
      "regions": [
        {"region_id": "region-recurrence-expression", "bbox": [0.18, 0.30, 0.64, 0.54], "kind": "equation"}
      ]
    }
  ],
  "cases": [
    {
      "case_id": "mmr1-diagram-01",
      "split": "development",
      "slice": "visual_answerable",
      "modality": "diagram",
      "asset_id": "mm-asset-diagram-flow",
      "query": "Which component processes the request immediately before the course store?",
      "expected_action": "retrieve",
      "required_claims": ["The gateway immediately precedes the course store."],
      "gold_region_ids": ["region-flow-sequence"],
      "visual_dependency": "visual_semantics_required",
      "review": {"status": "synthetic_constructed", "researcher_verified": false, "notes": "Answer depends on arrow direction and spatial order."}
    },
    {
      "case_id": "mmr1-chart-01",
      "split": "development",
      "slice": "visual_answerable",
      "modality": "chart",
      "asset_id": "mm-asset-latency-chart",
      "query": "Which method has the highest warm query latency, and what value is shown?",
      "expected_action": "retrieve",
      "required_claims": ["M1 has the highest latency.", "The shown value is 2.8 seconds."],
      "gold_region_ids": ["region-latency-bars"],
      "visual_dependency": "layout_required",
      "review": {"status": "synthetic_constructed", "researcher_verified": false, "notes": "Requires binding a bar label to its height and value."}
    },
    {
      "case_id": "mmr1-table-01",
      "split": "development",
      "slice": "visual_answerable",
      "modality": "table",
      "asset_id": "mm-asset-assessment-table",
      "query": "What combined percentage is assigned to the project and quizzes?",
      "expected_action": "retrieve",
      "required_claims": ["The project and quizzes together account for 65%."],
      "gold_region_ids": ["region-assessment-grid"],
      "visual_dependency": "layout_required",
      "review": {"status": "synthetic_constructed", "researcher_verified": false, "notes": "Requires two row-value bindings and addition."}
    },
    {
      "case_id": "mmr1-equation-01",
      "split": "development",
      "slice": "visual_answerable",
      "modality": "equation",
      "asset_id": "mm-asset-softmax-equation",
      "query": "In the displayed normalization, what values are included in the denominator sum?",
      "expected_action": "retrieve",
      "required_claims": ["The denominator sums exponentiated logits across all classes."],
      "gold_region_ids": ["region-softmax-expression"],
      "visual_dependency": "visual_semantics_required",
      "review": {"status": "synthetic_constructed", "researcher_verified": false, "notes": "The fraction and subscript structure carry the claim."}
    },
    {
      "case_id": "mmr1-screenshot-01",
      "split": "development",
      "slice": "visual_answerable",
      "modality": "screenshot",
      "asset_id": "mm-asset-settings-screen",
      "query": "Which setting is disabled on the course access screen?",
      "expected_action": "retrieve",
      "required_claims": ["Allow external providers is disabled."],
      "gold_region_ids": ["region-settings-panel"],
      "visual_dependency": "layout_required",
      "review": {"status": "synthetic_constructed", "researcher_verified": false, "notes": "Requires associating the grey toggle state with its row label."}
    },
    {
      "case_id": "mmr1-scan-01",
      "split": "development",
      "slice": "visual_answerable",
      "modality": "scanned_page",
      "asset_id": "mm-asset-scanned-notice",
      "query": "When does the scanned notice say submissions close?",
      "expected_action": "retrieve",
      "required_claims": ["Submissions close Friday at 18:00."],
      "gold_region_ids": ["region-notice-body"],
      "visual_dependency": "ocr_required",
      "review": {"status": "synthetic_constructed", "researcher_verified": false, "notes": "Rasterization is required before evaluation to exercise OCR."}
    },
    {
      "case_id": "mmr1-control-01",
      "split": "development",
      "slice": "text_control",
      "modality": "diagram",
      "asset_id": "mm-asset-diagram-flow",
      "query": "What general topic does the surrounding page text identify?",
      "expected_action": "retrieve",
      "required_claims": ["The page is about a request path."],
      "gold_region_ids": ["region-flow-title"],
      "visual_dependency": "text_sufficient",
      "review": {"status": "synthetic_constructed", "researcher_verified": false, "notes": "Control claim is present in surrounding text."}
    },
    {
      "case_id": "mmr1-boundary-01",
      "split": "development",
      "slice": "no_evidence",
      "modality": "chart",
      "asset_id": "mm-asset-latency-chart",
      "query": "What was the measured throughput at one hundred concurrent users?",
      "expected_action": "abstain",
      "required_claims": [],
      "gold_region_ids": [],
      "visual_dependency": "visual_semantics_required",
      "review": {"status": "synthetic_constructed", "researcher_verified": false, "notes": "The chart contains no concurrency or throughput evidence."}
    },
    {
      "case_id": "mmr1-integrity-01",
      "split": "development",